{
  "schema": "fm-today-answer.v1",
  "answer_id": "ans_01J9ZC4M2R",
  "task_id": "portal-rail-order",
  "kind": "decision",
  "value": "later",
  "card_hash": "3f62355fe0782827f04dd91c5bcc0c2d5360f139074f4cf5bfbea96ab0d02b6b",
  "answered_at": "2026-09-28T14:10:12Z",
  "person": "user_2captain",
  "device": "iphone-15",
  "later_until": "2026-09-29T14:00:00Z"
}
