{
  "schema": "fm-today-answer.v1",
  "answer_id": "ans_01J9ZC7Q5V",
  "task_id": "bridge-token",
  "kind": "credential",
  "value": "seen",
  "card_hash": "b96d8c0786fb913a46180fa2a4a995faf8c0a9ac735967ce15f87f4d37902cbc",
  "answered_at": "2026-09-28T14:10:12Z",
  "person": "user_2captain",
  "device": "iphone-15"
}
