{
  "schema": "fm-today-answer.v1",
  "answer_id": "ans_01J9ZC5N8S",
  "task_id": "today-t0",
  "kind": "merge",
  "value": "merge",
  "card_hash": "5e4ba60acc00349cb9283d6ec4fd20fd159676169a30c62b9acd46670dd78b23",
  "answered_at": "2026-09-28T14:10:12Z",
  "person": "user_2captain",
  "device": "iphone-15",
  "passkey": {
    "credential_id": "ZXhhbXBsZS1jcmVkZW50aWFsLWlkLTAwMDE",
    "authenticator_data": "AAAAAAAAAAAAAAAAAAAAAAAAAAAAAAAAAAAAAAAAAAAFAAAABw",
    "client_data_json": "eyJ0eXBlIjoid2ViYXV0aG4uZ2V0IiwiY2hhbGxlbmdlIjoiVHNGZExvaUV6OUE3RUxpaThSU0djdnpiLWlyMGhydFpCelVkZVFxQzZZcyIsIm9yaWdpbiI6Imh0dHBzOi8vYWRtaW4uZXhhbXBsZS5jb20iLCJjcm9zc09yaWdpbiI6ZmFsc2V9",
    "signature": "cGxhY2Vob2xkZXI6IGEgcmVhbCBhc3NlcnRpb24gY2FycmllcyBhIERFUiBFQ0RTQSBvciBFZERTQSBzaWduYXR1cmUgaGVyZQ"
  }
}
